{
  "messages": [
    {
      "date": "04/03/2024",
      "hour": "20:53",
      "sender": "lav",
      "type": "text",
      "content": "As mensagens e ligações são protegidas com a criptografia de ponta a ponta. Somente as pessoas que fazem parte da conversa podem ler, ouvir e compartilhar esse conteúdo.",
      "description": ""
    },
    {
      "date": "04/03/2024",
      "hour": "20:53",
      "sender": "lav",
      "type": "text",
      "content": "teteeh",
      "description": ""
    },
    {
      "date": "04/03/2024",
      "hour": "20:53",
      "sender": "lav",
      "type": "text",
      "content": "e o trabalho da Myrna???",
      "description": ""
    },
    {
      "date": "04/03/2024",
      "hour": "21:38",
      "sender": "steh",
      "type": "text",
      "content": "deu certo",
      "description": ""
    },
    {
      "date": "04/03/2024",
      "hour": "21:38",
      "sender": "steh",
      "type": "text",
      "content": "ja entregamos",
      "description": ""
    },
    {
      "date": "04/03/2024",
      "hour": "21:48",
      "sender": "lav",
      "type": "text",
      "content": "eita",
      "description": ""
    },
    {
      "date": "04/03/2024",
      "hour": "21:48",
      "sender": "lav",
      "type": "text",
      "content": "desculpa por não ajudar muito então :((",
      "description": ""
    },
    {
      "date": "04/03/2024",
      "hour": "21:48",
      "sender": "lav",
      "type": "text",
      "content": "mas que bom!!",
      "description": ""
    },
    {
      "date": "05/03/2024",
      "hour": "07:17",
      "sender": "steh",
      "type": "text",
      "content": "não",
      "description": ""
    },
    {
      "date": "05/03/2024",
      "hour": "07:29",
      "sender": "lav",
      "type": "text",
      "content": "vai se fuder então",
      "description": ""
    },
    {
      "date": "05/03/2024",
      "hour": "08:07",
      "sender": "steh",
      "type": "text",
      "content": "ufa",
      "description": ""
    },
    {
      "date": "05/03/2024",
      "hour": "08:07",
      "sender": "steh",
      "type": "text",
      "content": "😮‍💨😮‍💨😮‍💨😮‍💨",
      "description": ""
    },
    {
      "date": "08/03/2024",
      "hour": "17:45",
      "sender": "steh",
      "type": "text",
      "content": "oi meu amor",
      "description": ""
    },
    {
      "date": "08/03/2024",
      "hour": "17:48",
      "sender": "lav",
      "type": "text",
      "content": "oi vida",
      "description": ""
    },
    {
      "date": "08/03/2024",
      "hour": "18:33",
      "sender": "steh",
      "type": "text",
      "content": "sua chiquinha ficou cmg",
      "description": ""
    },
    {
      "date": "08/03/2024",
      "hour": "18:33",
      "sender": "steh",
      "type": "text",
      "content": "e vc fez o ngc de mat3",
      "description": ""
    },
    {
      "date": "08/03/2024",
      "hour": "18:33",
      "sender": "steh",
      "type": "text",
      "content": "?",
      "description": ""
    },
    {
      "date": "08/03/2024",
      "hour": "18:33",
      "sender": "steh",
      "type": "text",
      "content": "de justuficar sla",
      "description": ""
    },
    {
      "date": "08/03/2024",
      "hour": "18:42",
      "sender": "lav",
      "type": "text",
      "content": "fiz!",
      "description": ""
    },
    {
      "date": "08/03/2024",
      "hour": "18:43",
      "sender": "lav",
      "type": "text",
      "content": "mas agora eu tô na estação, posso te mandar depois??",
      "description": ""
    },
    {
      "date": "08/03/2024",
      "hour": "18:43",
      "sender": "steh",
      "type": "text",
      "content": "não 😡😡😡",
      "description": ""
    },
    {
      "date": "08/03/2024",
      "hour": "18:44",
      "sender": "lav",
      "type": "text",
      "content": "se fode então",
      "description": ""
    },
    {
      "date": "08/03/2024",
      "hour": "18:54",
      "sender": "lav",
      "type": "text",
      "content": "Stephany - 10,0: foi essencial para o desenvolvimento do trabalho, abordagem simples e objetiva, contribuindo em todas as etapas do projeto.",
      "description": ""
    },
    {
      "date": "08/03/2024",
      "hour": "18:54",
      "sender": "lav",
      "type": "text",
      "content": "só não fiz o meu pq eu não sei",
      "description": ""
    },
    {
      "date": "08/03/2024",
      "hour": "18:54",
      "sender": "lav",
      "type": "text",
      "content": "usei até valor germinare cê viu",
      "description": ""
    },
    {
      "date": "08/03/2024",
      "hour": "19:04",
      "sender": "steh",
      "type": "text",
      "content": "uouuu",
      "description": ""
    },
    {
      "date": "08/03/2024",
      "hour": "19:04",
      "sender": "steh",
      "type": "text",
      "content": "okok",
      "description": ""
    },
    {
      "date": "18/03/2024",
      "hour": "11:35",
      "sender": "steh",
      "type": "text",
      "content": "https://www.canva.com/design/DAF_3jJ9Smk/s7YqTDpipToCHVsVAghHmg/edit?utm_content=DAF_3jJ9Smk&utm_campaign=designshare&utm_medium=link2&utm_source=sharebutton",
      "description": ""
    },
    {
      "date": "19/04/2024",
      "hour": "12:23",
      "sender": "steh",
      "type": "text",
      "content": "lavi",
      "description": ""
    },
    {
      "date": "19/04/2024",
      "hour": "12:23",
      "sender": "steh",
      "type": "text",
      "content": "vc tem absorvente?",
      "description": ""
    },
    {
      "date": "19/04/2024",
      "hour": "12:37",
      "sender": "lav",
      "type": "text",
      "content": "não",
      "description": ""
    },
    {
      "date": "19/04/2024",
      "hour": "12:38",
      "sender": "steh",
      "type": "text",
      "content": "ata",
      "description": ""
    },
    {
      "date": "27/04/2024",
      "hour": "23:54",
      "sender": "steh",
      "type": "text",
      "content": "Ligação de voz. Não atendida",
      "description": ""
    },
    {
      "date": "28/04/2024",
      "hour": "21:05",
      "sender": "steh",
      "type": "image",
      "content": "00000034-PHOTO-2024-04-28-21-05-35.jpg",
      "description": ""
    },
    {
      "date": "28/04/2024",
      "hour": "21:08",
      "sender": "steh",
      "type": "text",
      "content": "limpa alumínio",
      "description": ""
    },
    {
      "date": "29/04/2024",
      "hour": "19:06",
      "sender": "steh",
      "type": "text",
      "content": "lavinia feitosa",
      "description": ""
    },
    {
      "date": "29/04/2024",
      "hour": "19:07",
      "sender": "steh",
      "type": "text",
      "content": "imagem ocultada",
      "description": ""
    },
    {
      "date": "29/04/2024",
      "hour": "19:13",
      "sender": "lav",
      "type": "text",
      "content": "MEU DEUS MEU DEUS",
      "description": ""
    },
    {
      "date": "29/04/2024",
      "hour": "19:58",
      "sender": "steh",
      "type": "text",
      "content": "é meio que agora",
      "description": ""
    },
    {
      "date": "29/04/2024",
      "hour": "20:02",
      "sender": "lav",
      "type": "text",
      "content": "É AGORA TETEH",
      "description": ""
    },
    {
      "date": "29/04/2024",
      "hour": "20:02",
      "sender": "lav",
      "type": "text",
      "content": "posta foto gatona",
      "description": ""
    },
    {
      "date": "30/04/2024",
      "hour": "18:04",
      "sender": "steh",
      "type": "text",
      "content": "lav",
      "description": ""
    },
    {
      "date": "30/04/2024",
      "hour": "18:54",
      "sender": "lav",
      "type": "text",
      "content": "oi",
      "description": ""
    },
    {
      "date": "30/04/2024",
      "hour": "19:01",
      "sender": "lav",
      "type": "text",
      "content": "notas",
      "description": ""
    },
    {
      "date": "30/04/2024",
      "hour": "19:01",
      "sender": "lav",
      "type": "text",
      "content": "Sofia, eu não vou mentir pra você, eu não quero nada sério agora. Eu realmente gosto de você, mas eu esperava que a gente fosse mais devagar, e se você não quer isso eu não sei se seria uma boa escolha continuar conversando com você porque eu não quero mesmo te machucar.",
      "description": ""
    },
    {
      "date": "30/04/2024",
      "hour": "19:04",
      "sender": "steh",
      "type": "text",
      "content": "ta bom",
      "description": ""
    },
    {
      "date": "30/04/2024",
      "hour": "19:04",
      "sender": "steh",
      "type": "text",
      "content": "e fala ora ela q a gente n tem nada",
      "description": ""
    },
    {
      "date": "30/04/2024",
      "hour": "19:04",
      "sender": "steh",
      "type": "text",
      "content": "e q n é por causa de mim q vc quer terminar om ela",
      "description": ""
    },
    {
      "date": "30/04/2024",
      "hour": "19:14",
      "sender": "lav",
      "type": "text",
      "content": "como pode terminar com conversante",
      "description": ""
    },
    {
      "date": "30/04/2024",
      "hour": "19:36",
      "sender": "steh",
      "type": "text",
      "content": "🤷‍♀️🤷‍♀️",
      "description": ""
    },
    {
      "date": "30/04/2024",
      "hour": "19:36",
      "sender": "steh",
      "type": "text",
      "content": "oq vc ta fazendo é literalmente terminar um nada",
      "description": ""
    },
    {
      "date": "30/04/2024",
      "hour": "19:38",
      "sender": "lav",
      "type": "sticker",
      "content": "00000052-STICKER-2024-04-30-19-38-17.webp",
      "description": ""
    },
    {
      "date": "30/04/2024",
      "hour": "19:40",
      "sender": "steh",
      "type": "text",
      "content": "🤷‍♀️🤷‍♀️🤷‍♀️",
      "description": ""
    },
    {
      "date": "30/04/2024",
      "hour": "19:40",
      "sender": "lav",
      "type": "text",
      "content": "imagem ocultada",
      "description": ""
    },
    {
      "date": "30/04/2024",
      "hour": "19:41",
      "sender": "steh",
      "type": "text",
      "content": "meu deus",
      "description": ""
    },
    {
      "date": "30/04/2024",
      "hour": "19:42",
      "sender": "steh",
      "type": "text",
      "content": "vcs escrevem com ponto final",
      "description": ""
    },
    {
      "date": "30/04/2024",
      "hour": "19:42",
      "sender": "steh",
      "type": "text",
      "content": "e bem",
      "description": ""
    },
    {
      "date": "30/04/2024",
      "hour": "19:42",
      "sender": "steh",
      "type": "text",
      "content": "me sentiria subestimada",
      "description": ""
    },
    {
      "date": "30/04/2024",
      "hour": "19:42",
      "sender": "steh",
      "type": "text",
      "content": "eu odeio textao",
      "description": ""
    },
    {
      "date": "30/04/2024",
      "hour": "19:42",
      "sender": "steh",
      "type": "text",
      "content": "mando 25 mensagens separadas",
      "description": ""
    },
    {
      "date": "30/04/2024",
      "hour": "19:43",
      "sender": "lav",
      "type": "text",
      "content": "eu não escrevo com ponto final eu só tô falando assim pra parecer que tô falando sério",
      "description": ""
    },
    {
      "date": "30/04/2024",
      "hour": "19:43",
      "sender": "lav",
      "type": "sticker",
      "content": "00000062-STICKER-2024-04-30-19-43-54.webp",
      "description": ""
    },
    {
      "date": "30/04/2024",
      "hour": "19:45",
      "sender": "steh",
      "type": "text",
      "content": "meu jesus",
      "description": ""
    },
    {
      "date": "30/04/2024",
      "hour": "19:45",
      "sender": "steh",
      "type": "text",
      "content": "tenho medi de vcs duas",
      "description": ""
    },
    {
      "date": "30/04/2024",
      "hour": "19:45",
      "sender": "lav",
      "type": "text",
      "content": "KAJSKAKSKAKSKAKKSKSKSKS",
      "description": ""
    },
    {
      "date": "30/04/2024",
      "hour": "19:45",
      "sender": "lav",
      "type": "text",
      "content": "aí sério como pode essas coisas só acontecem comigo mesmo",
      "description": ""
    },
    {
      "date": "30/04/2024",
      "hour": "19:46",
      "sender": "lav",
      "type": "text",
      "content": "fiquei o ano todo sem falar com ninguém pra quando falar terminar enquanto é conversante",
      "description": ""
    },
    {
      "date": "30/04/2024",
      "hour": "19:46",
      "sender": "steh",
      "type": "text",
      "content": "vc meil q mamou",
      "description": ""
    },
    {
      "date": "30/04/2024",
      "hour": "19:47",
      "sender": "steh",
      "type": "text",
      "content": "as vzs a vida faz vc twrminae com conversante",
      "description": ""
    },
    {
      "date": "30/04/2024",
      "hour": "19:48",
      "sender": "lav",
      "type": "text",
      "content": "mamei demais e nem mamei",
      "description": ""
    },
    {
      "date": "30/04/2024",
      "hour": "19:48",
      "sender": "lav",
      "type": "text",
      "content": "eu nem fiz nada pra mamar sabe",
      "description": ""
    },
    {
      "date": "30/04/2024",
      "hour": "19:50",
      "sender": "steh",
      "type": "text",
      "content": "vc nem mamou cara",
      "description": ""
    },
    {
      "date": "30/04/2024",
      "hour": "19:50",
      "sender": "steh",
      "type": "text",
      "content": "tipo",
      "description": ""
    },
    {
      "date": "30/04/2024",
      "hour": "19:50",
      "sender": "steh",
      "type": "text",
      "content": "nem isso",
      "description": ""
    },
    {
      "date": "30/04/2024",
      "hour": "20:43",
      "sender": "steh",
      "type": "text",
      "content": "https://vm.tiktok.com/ZMMpw4hGC/",
      "description": ""
    },
    {
      "date": "30/04/2024",
      "hour": "21:21",
      "sender": "lav",
      "type": "text",
      "content": "PARA COM ISSO",
      "description": ""
    },
    {
      "date": "30/04/2024",
      "hour": "21:21",
      "sender": "lav",
      "type": "text",
      "content": "nada a ve",
      "description": ""
    },
    {
      "date": "30/04/2024",
      "hour": "22:06",
      "sender": "steh",
      "type": "text",
      "content": "tudo a ve",
      "description": ""
    },
    {
      "date": "30/04/2024",
      "hour": "22:21",
      "sender": "lav",
      "type": "text",
      "content": "eu não tenho ex nenhuma e não tratei ela como namorada não",
      "description": ""
    },
    {
      "date": "30/04/2024",
      "hour": "22:21",
      "sender": "lav",
      "type": "text",
      "content": "teteh hj tavam falando do João e da menina lá na picpay",
      "description": ""
    },
    {
      "date": "30/04/2024",
      "hour": "22:23",
      "sender": "steh",
      "type": "text",
      "content": "que joao e que menina da pic pay",
      "description": ""
    },
    {
      "date": "30/04/2024",
      "hour": "22:23",
      "sender": "steh",
      "type": "text",
      "content": "atat",
      "description": ""
    },
    {
      "date": "30/04/2024",
      "hour": "22:23",
      "sender": "steh",
      "type": "text",
      "content": "o joao",
      "description": ""
    },
    {
      "date": "30/04/2024",
      "hour": "22:23",
      "sender": "steh",
      "type": "text",
      "content": "victor",
      "description": ""
    },
    {
      "date": "30/04/2024",
      "hour": "22:24",
      "sender": "steh",
      "type": "text",
      "content": "lina",
      "description": ""
    },
    {
      "date": "30/04/2024",
      "hour": "22:24",
      "sender": "steh",
      "type": "text",
      "content": "da silva",
      "description": ""
    },
    {
      "date": "30/04/2024",
      "hour": "22:24",
      "sender": "steh",
      "type": "text",
      "content": "😭",
      "description": ""
    },
    {
      "date": "30/04/2024",
      "hour": "22:24",
      "sender": "steh",
      "type": "text",
      "content": "oq falaram",
      "description": ""
    },
    {
      "date": "30/04/2024",
      "hour": "22:29",
      "sender": "lav",
      "type": "text",
      "content": "KAKSKAKSKKAKSKDD",
      "description": ""
    },
    {
      "date": "30/04/2024",
      "hour": "22:29",
      "sender": "lav",
      "type": "text",
      "content": "tavam discutindo se ele era bonito ou feio",
      "description": ""
    },
    {
      "date": "30/04/2024",
      "hour": "22:30",
      "sender": "lav",
      "type": "text",
      "content": "a Mirella e o Davi disseram que ele é bonito e o Marcus e o Stalberg disseram feio",
      "description": ""
    },
    {
      "date": "30/04/2024",
      "hour": "22:30",
      "sender": "steh",
      "type": "text",
      "content": "ele é lindo",
      "description": ""
    },
    {
      "date": "30/04/2024",
      "hour": "22:34",
      "sender": "steh",
      "type": "text",
      "content": "fake",
      "description": ""
    },
    {
      "date": "30/04/2024",
      "hour": "22:34",
      "sender": "steh",
      "type": "text",
      "content": "tipo",
      "description": ""
    },
    {
      "date": "30/04/2024",
      "hour": "22:34",
      "sender": "steh",
      "type": "text",
      "content": "já deu",
      "description": ""
    },
    {
      "date": "30/04/2024",
      "hour": "22:34",
      "sender": "steh",
      "type": "text",
      "content": "um ano",
      "description": ""
    },
    {
      "date": "30/04/2024",
      "hour": "23:02",
      "sender": "lav",
      "type": "text",
      "content": "supera teteh pelo amor de deus",
      "description": ""
    },
    {
      "date": "01/05/2024",
      "hour": "08:19",
      "sender": "steh",
      "type": "text",
      "content": "😭",
      "description": ""
    },
    {
      "date": "01/05/2024",
      "hour": "13:25",
      "sender": "lav",
      "type": "text",
      "content": "imagem ocultada",
      "description": ""
    },
    {
      "date": "01/05/2024",
      "hour": "13:48",
      "sender": "steh",
      "type": "text",
      "content": "lorax mais perigoso dq o perigoso",
      "description": ""
    },
    {
      "date": "01/05/2024",
      "hour": "16:28",
      "sender": "steh",
      "type": "text",
      "content": "https://vm.tiktok.com/ZMMsBWkVH/",
      "description": ""
    },
    {
      "date": "01/05/2024",
      "hour": "16:39",
      "sender": "lav",
      "type": "text",
      "content": "https://vm.tiktok.com/ZMMsSJ6co/",
      "description": ""
    },
    {
      "date": "01/05/2024",
      "hour": "17:01",
      "sender": "steh",
      "type": "text",
      "content": "as vzs a culpa n é do video",
      "description": ""
    },
    {
      "date": "02/05/2024",
      "hour": "09:18",
      "sender": "steh",
      "type": "text",
      "content": "<svg width=\"4250\" height=\"4250\" viewBox=\"0 0 4250 4250\" fill=\"none\" xmlns=\"http://www.w3.org/2000/svg\">",
      "description": ""
    },
    {
      "date": "02/05/2024",
      "hour": "16:42",
      "sender": "lav",
      "type": "text",
      "content": "onde.onde vc tá?",
      "description": ""
    },
    {
      "date": "02/05/2024",
      "hour": "16:52",
      "sender": "steh",
      "type": "text",
      "content": "segundo andar",
      "description": ""
    },
    {
      "date": "02/05/2024",
      "hour": "16:52",
      "sender": "steh",
      "type": "text",
      "content": "sala 212",
      "description": ""
    },
    {
      "date": "02/05/2024",
      "hour": "16:56",
      "sender": "lav",
      "type": "text",
      "content": "tá em reunião?",
      "description": ""
    },
    {
      "date": "02/05/2024",
      "hour": "16:57",
      "sender": "steh",
      "type": "text",
      "content": "ateparece",
      "description": ""
    },
    {
      "date": "02/05/2024",
      "hour": "16:57",
      "sender": "steh",
      "type": "text",
      "content": "nao",
      "description": ""
    },
    {
      "date": "02/05/2024",
      "hour": "16:59",
      "sender": "lav",
      "type": "text",
      "content": "KAKSKAKSKAKKSKSKS",
      "description": ""
    },
    {
      "date": "03/05/2024",
      "hour": "10:43",
      "sender": "steh",
      "type": "text",
      "content": "import pandas as pd",
      "description": ""
    },
    {
      "date": "03/05/2024",
      "hour": "10:47",
      "sender": "steh",
      "type": "text",
      "content": "kfold =KFold(n_splits=4,shuffle=True,random_state=0)",
      "description": ""
    },
    {
      "date": "03/05/2024",
      "hour": "10:55",
      "sender": "steh",
      "type": "text",
      "content": "dfresposta=dfdados['atraso'].to_frame()",
      "description": ""
    },
    {
      "date": "03/05/2024",
      "hour": "10:56",
      "sender": "steh",
      "type": "text",
      "content": "classificador.fit(xtreino,ytreino)",
      "description": ""
    },
    {
      "date": "03/05/2024",
      "hour": "16:16",
      "sender": "lav",
      "type": "text",
      "content": "https://vm.tiktok.com/ZMMGr5eYg/",
      "description": ""
    },
    {
      "date": "03/05/2024",
      "hour": "17:06",
      "sender": "steh",
      "type": "text",
      "content": "nao peguei legal",
      "description": ""
    },
    {
      "date": "03/05/2024",
      "hour": "17:18",
      "sender": "lav",
      "type": "text",
      "content": "seus conselhos",
      "description": ""
    },
    {
      "date": "03/05/2024",
      "hour": "22:41",
      "sender": "steh",
      "type": "image",
      "content": "00000119-PHOTO-2024-05-03-22-41-15.jpg",
      "description": ""
    },
    {
      "date": "03/05/2024",
      "hour": "22:42",
      "sender": "steh",
      "type": "text",
      "content": "e ele",
      "description": ""
    },
    {
      "date": "03/05/2024",
      "hour": "22:42",
      "sender": "steh",
      "type": "text",
      "content": "postou",
      "description": ""
    },
    {
      "date": "03/05/2024",
      "hour": "22:42",
      "sender": "steh",
      "type": "text",
      "content": "com outra",
      "description": ""
    },
    {
      "date": "03/05/2024",
      "hour": "22:42",
      "sender": "steh",
      "type": "text",
      "content": "🤙",
      "description": ""
    },
    {
      "date": "03/05/2024",
      "hour": "22:51",
      "sender": "steh",
      "type": "text",
      "content": "foi ao pra me atingir certeza",
      "description": ""
    },
    {
      "date": "03/05/2024",
      "hour": "22:51",
      "sender": "steh",
      "type": "text",
      "content": "ele meio q me ama",
      "description": ""
    },
    {
      "date": "03/05/2024",
      "hour": "22:51",
      "sender": "steh",
      "type": "text",
      "content": "e a gente vai casar",
      "description": ""
    },
    {
      "date": "03/05/2024",
      "hour": "22:51",
      "sender": "steh",
      "type": "text",
      "content": "sabw",
      "description": ""
    },
    {
      "date": "03/05/2024",
      "hour": "22:51",
      "sender": "steh",
      "type": "text",
      "content": "ele ta mais feliz com ela",
      "description": ""
    },
    {
      "date": "03/05/2024",
      "hour": "22:51",
      "sender": "steh",
      "type": "text",
      "content": "acho q acabou lavi",
      "description": ""
    },
    {
      "date": "03/05/2024",
      "hour": "22:51",
      "sender": "steh",
      "type": "text",
      "content": "eu realmente tenho que superar",
      "description": ""
    },
    {
      "date": "03/05/2024",
      "hour": "22:51",
      "sender": "steh",
      "type": "text",
      "content": "c ele ta feliz",
      "description": ""
    },
    {
      "date": "03/05/2024",
      "hour": "22:52",
      "sender": "steh",
      "type": "text",
      "content": "quero que se explodam",
      "description": ""
    },
    {
      "date": "04/05/2024",
      "hour": "11:55",
      "sender": "lav",
      "type": "text",
      "content": "certeza",
      "description": ""
    },
    {
      "date": "04/05/2024",
      "hour": "11:55",
      "sender": "lav",
      "type": "text",
      "content": "e ele ainda falou mal da música",
      "description": ""
    },
    {
      "date": "04/05/2024",
      "hour": "11:55",
      "sender": "lav",
      "type": "text",
      "content": "ele é tão feinho teteh",
      "description": ""
    },
    {
      "date": "04/05/2024",
      "hour": "11:55",
      "sender": "lav",
      "type": "text",
      "content": "tem mesmo",
      "description": ""
    },
    {
      "date": "04/05/2024",
      "hour": "14:46",
      "sender": "lav",
      "type": "text",
      "content": "vc vem pra Gabi?",
      "description": ""
    },
    {
      "date": "04/05/2024",
      "hour": "15:02",
      "sender": "steh",
      "type": "text",
      "content": "nao😭😭",
      "description": ""
    },
    {
      "date": "04/05/2024",
      "hour": "15:07",
      "sender": "lav",
      "type": "sticker",
      "content": "00000139-STICKER-2024-05-04-15-07-36.webp",
      "description": ""
    },
    {
      "date": "04/05/2024",
      "hour": "16:01",
      "sender": "lav",
      "type": "text",
      "content": "teteh estou amando a mãe da gabi",
      "description": ""
    },
    {
      "date": "04/05/2024",
      "hour": "16:51",
      "sender": "steh",
      "type": "text",
      "content": "é so fogo",
      "description": ""
    },
    {
      "date": "04/05/2024",
      "hour": "16:51",
      "sender": "steh",
      "type": "text",
      "content": "vai fazer trabalho vai maluca",
      "description": ""
    },
    {
      "date": "04/05/2024",
      "hour": "17:01",
      "sender": "lav",
      "type": "sticker",
      "content": "00000143-STICKER-2024-05-04-17-01-59.webp",
      "description": ""
    },
    {
      "date": "04/05/2024",
      "hour": "17:02",
      "sender": "lav",
      "type": "text",
      "content": "tô fazendo",
      "description": ""
    },
    {
      "date": "04/05/2024",
      "hour": "17:02",
      "sender": "lav",
      "type": "text",
      "content": "eu sou multitarefas",
      "description": ""
    },
    {
      "date": "04/05/2024",
      "hour": "18:10",
      "sender": "lav",
      "type": "text",
      "content": "ela me quer tanto((me abraçou quando eu fui embora",
      "description": ""
    },
    {
      "date": "04/05/2024",
      "hour": "18:15",
      "sender": "steh",
      "type": "text",
      "content": "ai tomaaaaaaaaa",
      "description": ""
    },
    {
      "date": "04/05/2024",
      "hour": "18:15",
      "sender": "steh",
      "type": "text",
      "content": "amassou lavinia",
      "description": ""
    },
    {
      "date": "04/05/2024",
      "hour": "18:16",
      "sender": "steh",
      "type": "text",
      "content": "ela ta na sua cara",
      "description": ""
    },
    {
      "date": "04/05/2024",
      "hour": "18:22",
      "sender": "lav",
      "type": "text",
      "content": "tá muito na minha fala sério",
      "description": ""
    },
    {
      "date": "04/05/2024",
      "hour": "18:25",
      "sender": "steh",
      "type": "text",
      "content": "ppretissimo",
      "description": ""
    },
    {
      "date": "04/05/2024",
      "hour": "18:25",
      "sender": "steh",
      "type": "text",
      "content": "lavinia nao sei oq eu faço na logo do interdiciplinar",
      "description": ""
    },
    {
      "date": "04/05/2024",
      "hour": "18:26",
      "sender": "lav",
      "type": "text",
      "content": "mas não tava feita já?",
      "description": ""
    },
    {
      "date": "04/05/2024",
      "hour": "18:26",
      "sender": "steh",
      "type": "text",
      "content": "nao gostaram",
      "description": ""
    },
    {
      "date": "04/05/2024",
      "hour": "18:26",
      "sender": "steh",
      "type": "text",
      "content": "e agr ta indo pra um lugar meio estranho",
      "description": ""
    },
    {
      "date": "04/05/2024",
      "hour": "18:27",
      "sender": "steh",
      "type": "image",
      "content": "00000156-PHOTO-2024-05-04-18-27-09.jpg",
      "description": ""
    },
    {
      "date": "04/05/2024",
      "hour": "19:01",
      "sender": "lav",
      "type": "text",
      "content": "AKKSKAKSKKAAKSKAJKSKAJAJAJJAAAJJAJSJSJAA",
      "description": ""
    },
    {
      "date": "04/05/2024",
      "hour": "19:01",
      "sender": "lav",
      "type": "text",
      "content": "o do fundo branco tá legal",
      "description": ""
    },
    {
      "date": "04/05/2024",
      "hour": "20:27",
      "sender": "steh",
      "type": "text",
      "content": "o fundo branco é a referência",
      "description": ""
    },
    {
      "date": "04/05/2024",
      "hour": "20:27",
      "sender": "steh",
      "type": "text",
      "content": "😓😓",
      "description": ""
    },
    {
      "date": "05/05/2024",
      "hour": "12:34",
      "sender": "lav",
      "type": "text",
      "content": "KAKSKAKSKKAKAKAKAKAKAKAKAKAKKAKSKSKAKAKAKKSKWKWKKAKAA PUTS",
      "description": ""
    },
    {
      "date": "06/05/2024",
      "hour": "09:22",
      "sender": "steh",
      "type": "text",
      "content": "🐭🎀",
      "description": ""
    },
    {
      "date": "07/05/2024",
      "hour": "11:06",
      "sender": "steh",
      "type": "text",
      "content": "01 vendas validas = CALCULATE(SUMX(Fato_venda,Fato_venda[Qtde]*Fato_venda[Pr_Unit]),Fato_venda[Situacao] == \"N\")",
      "description": ""
    },
    {
      "date": "07/05/2024",
      "hour": "13:19",
      "sender": "lav",
      "type": "image",
      "content": "00000164-PHOTO-2024-05-07-13-19-43.jpg",
      "description": ""
    },
    {
      "date": "07/05/2024",
      "hour": "13:19",
      "sender": "lav",
      "type": "image",
      "content": "00000165-PHOTO-2024-05-07-13-19-44.jpg",
      "description": ""
    },
    {
      "date": "07/05/2024",
      "hour": "13:19",
      "sender": "lav",
      "type": "image",
      "content": "00000166-PHOTO-2024-05-07-13-19-44.jpg",
      "description": ""
    },
    {
      "date": "07/05/2024",
      "hour": "13:19",
      "sender": "lav",
      "type": "image",
      "content": "00000167-PHOTO-2024-05-07-13-19-44.jpg",
      "description": ""
    },
    {
      "date": "07/05/2024",
      "hour": "13:19",
      "sender": "lav",
      "type": "image",
      "content": "00000168-PHOTO-2024-05-07-13-19-45.jpg",
      "description": ""
    },
    {
      "date": "08/05/2024",
      "hour": "06:41",
      "sender": "steh",
      "type": "text",
      "content": "https://open.spotify.com/track/3owZapu16Fb3v2xb8K6CO9?si=EDM4wcOSRHuvQQvThF8hwQ&context=spotify%3Asearch%3Aamanhecer",
      "description": ""
    },
    {
      "date": "08/05/2024",
      "hour": "07:42",
      "sender": "steh",
      "type": "text",
      "content": "https://www.ticketmaster.com.br/event/bruno-mars-sao-paulo-dia-08",
      "description": ""
    },
    {
      "date": "08/05/2024",
      "hour": "16:14",
      "sender": "steh",
      "type": "text",
      "content": "o elyas tem 25",
      "description": ""
    },
    {
      "date": "08/05/2024",
      "hour": "16:15",
      "sender": "lav",
      "type": "text",
      "content": "novinho cara",
      "description": ""
    },
    {
      "date": "08/05/2024",
      "hour": "16:15",
      "sender": "lav",
      "type": "text",
      "content": "ele parece ter mais",
      "description": ""
    },
    {
      "date": "08/05/2024",
      "hour": "16:15",
      "sender": "lav",
      "type": "text",
      "content": "mó calvo",
      "description": ""
    },
    {
      "date": "09/05/2024",
      "hour": "16:33",
      "sender": "steh",
      "type": "text",
      "content": "perdi o joao de vista",
      "description": ""
    },
    {
      "date": "09/05/2024",
      "hour": "16:34",
      "sender": "lav",
      "type": "text",
      "content": "o lima?",
      "description": ""
    },
    {
      "date": "10/05/2024",
      "hour": "09:23",
      "sender": "steh",
      "type": "text",
      "content": "motivo da expulsão: bruno mars",
      "description": ""
    },
    {
      "date": "10/05/2024",
      "hour": "09:23",
      "sender": "steh",
      "type": "text",
      "content": "meu",
      "description": ""
    },
    {
      "date": "10/05/2024",
      "hour": "09:23",
      "sender": "steh",
      "type": "text",
      "content": "a marina comeu as duas",
      "description": ""
    },
    {
      "date": "10/05/2024",
      "hour": "09:32",
      "sender": "lav",
      "type": "text",
      "content": "a marina tá é precisando que alguém coma ela",
      "description": ""
    },
    {
      "date": "10/05/2024",
      "hour": "09:32",
      "sender": "steh",
      "type": "text",
      "content": "meu",
      "description": ""
    },
    {
      "date": "10/05/2024",
      "hour": "09:32",
      "sender": "steh",
      "type": "text",
      "content": "sim",
      "description": ""
    },
    {
      "date": "10/05/2024",
      "hour": "09:35",
      "sender": "steh",
      "type": "text",
      "content": "mano acho que ela vai reclamar do tamanho",
      "description": ""
    },
    {
      "date": "10/05/2024",
      "hour": "09:35",
      "sender": "lav",
      "type": "text",
      "content": "fodase",
      "description": ""
    },
    {
      "date": "10/05/2024",
      "hour": "09:35",
      "sender": "lav",
      "type": "text",
      "content": "ela reclama se tá pequeno e reclama se ta grande tbm",
      "description": ""
    },
    {
      "date": "10/05/2024",
      "hour": "09:35",
      "sender": "steh",
      "type": "text",
      "content": "meu ela n sabe oq quer tbm",
      "description": ""
    },
    {
      "date": "10/05/2024",
      "hour": "09:35",
      "sender": "lav",
      "type": "text",
      "content": "meu",
      "description": ""
    },
    {
      "date": "10/05/2024",
      "hour": "09:35",
      "sender": "lav",
      "type": "text",
      "content": "ela não sabe nem quem é o pai dela",
      "description": ""
    },
    {
      "date": "10/05/2024",
      "hour": "09:36",
      "sender": "steh",
      "type": "text",
      "content": "meu",
      "description": ""
    },
    {
      "date": "10/05/2024",
      "hour": "09:36",
      "sender": "steh",
      "type": "text",
      "content": "eu tbm n sei quem é o meu",
      "description": ""
    },
    {
      "date": "13/05/2024",
      "hour": "08:50",
      "sender": "steh",
      "type": "text",
      "content": "lavinia",
      "description": ""
    },
    {
      "date": "13/05/2024",
      "hour": "08:51",
      "sender": "steh",
      "type": "text",
      "content": "sua mãe ja chegou??",
      "description": ""
    },
    {
      "date": "13/05/2024",
      "hour": "08:51",
      "sender": "steh",
      "type": "text",
      "content": "vc ja foi?",
      "description": ""
    },
    {
      "date": "13/05/2024",
      "hour": "08:51",
      "sender": "steh",
      "type": "text",
      "content": "seu fone ficou agui",
      "description": ""
    },
    {
      "date": "13/05/2024",
      "hour": "08:51",
      "sender": "lav",
      "type": "text",
      "content": "já",
      "description": ""
    },
    {
      "date": "13/05/2024",
      "hour": "08:51",
      "sender": "lav",
      "type": "sticker",
      "content": "00000196-STICKER-2024-05-13-08-51-44.webp",
      "description": ""
    },
    {
      "date": "20/05/2024",
      "hour": "12:05",
      "sender": "steh",
      "type": "text",
      "content": "import psycopg2",
      "description": ""
    },
    {
      "date": "20/05/2024",
      "hour": "12:06",
      "sender": "steh",
      "type": "text",
      "content": "cur.execute(f\"call inserir_cotacao_dolar('{data_atual}','{horario}',{dolar})\")",
      "description": ""
    },
    {
      "date": "03/06/2024",
      "hour": "14:10",
      "sender": "lav",
      "type": "image",
      "content": "00000199-PHOTO-2024-06-03-14-10-38.jpg",
      "description": ""
    },
    {
      "date": "04/06/2024",
      "hour": "08:46",
      "sender": "steh",
      "type": "text",
      "content": "https://www.notion.so/queijos-e9751b3a278543b1898cf7e2a6ce85ad?pvs=4",
      "description": ""
    },
    {
      "date": "04/06/2024",
      "hour": "08:50",
      "sender": "steh",
      "type": "text",
      "content": "https://www.notion.so/Tabua-de-frios-e9751b3a278543b1898cf7e2a6ce85ad?pvs=4",
      "description": ""
    },
    {
      "date": "06/06/2024",
      "hour": "15:05",
      "sender": "lav",
      "type": "image",
      "content": "00000202-PHOTO-2024-06-06-15-05-22.jpg",
      "description": ""
    },
    {
      "date": "09/06/2024",
      "hour": "19:17",
      "sender": "steh",
      "type": "text",
      "content": "lav",
      "description": ""
    },
    {
      "date": "09/06/2024",
      "hour": "19:19",
      "sender": "lav",
      "type": "text",
      "content": "oi vida",
      "description": ""
    },
    {
      "date": "09/06/2024",
      "hour": "19:28",
      "sender": "steh",
      "type": "text",
      "content": "fez toda a lista da lisete?",
      "description": ""
    },
    {
      "date": "09/06/2024",
      "hour": "19:56",
      "sender": "lav",
      "type": "text",
      "content": "nem",
      "description": ""
    },
    {
      "date": "09/06/2024",
      "hour": "20:08",
      "sender": "steh",
      "type": "text",
      "content": "é pra essa semana?",
      "description": ""
    },
    {
      "date": "09/06/2024",
      "hour": "20:08",
      "sender": "steh",
      "type": "text",
      "content": "ou pra amanha mesmo",
      "description": ""
    },
    {
      "date": "09/06/2024",
      "hour": "21:59",
      "sender": "lav",
      "type": "text",
      "content": "sexta eu acho",
      "description": ""
    },
    {
      "date": "10/06/2024",
      "hour": "12:53",
      "sender": "steh",
      "type": "text",
      "content": "oi lavi",
      "description": ""
    },
    {
      "date": "10/06/2024",
      "hour": "12:53",
      "sender": "steh",
      "type": "text",
      "content": "ta bem?",
      "description": ""
    },
    {
      "date": "10/06/2024",
      "hour": "12:53",
      "sender": "steh",
      "type": "text",
      "content": "ta maL?",
      "description": ""
    },
    {
      "date": "10/06/2024",
      "hour": "12:53",
      "sender": "steh",
      "type": "text",
      "content": "vai embora?",
      "description": ""
    },
    {
      "date": "10/06/2024",
      "hour": "12:54",
      "sender": "steh",
      "type": "text",
      "content": "vai trabalhar?",
      "description": ""
    },
    {
      "date": "10/06/2024",
      "hour": "12:57",
      "sender": "lav",
      "type": "text",
      "content": "tô voltando",
      "description": ""
    },
    {
      "date": "17/06/2024",
      "hour": "19:50",
      "sender": "steh",
      "type": "text",
      "content": "lavinia",
      "description": ""
    },
    {
      "date": "17/06/2024",
      "hour": "19:50",
      "sender": "steh",
      "type": "text",
      "content": "esta feito o roteiro",
      "description": ""
    },
    {
      "date": "17/06/2024",
      "hour": "19:50",
      "sender": "steh",
      "type": "text",
      "content": "quer que eu traduza metade e vc a outr?",
      "description": ""
    },
    {
      "date": "17/06/2024",
      "hour": "19:50",
      "sender": "steh",
      "type": "text",
      "content": "pra agilizar?",
      "description": ""
    },
    {
      "date": "17/06/2024",
      "hour": "19:53",
      "sender": "lav",
      "type": "text",
      "content": "se vc quiser pode me mandar tudo meu bem",
      "description": ""
    },
    {
      "date": "17/06/2024",
      "hour": "19:53",
      "sender": "lav",
      "type": "text",
      "content": "de boa",
      "description": ""
    },
    {
      "date": "17/06/2024",
      "hour": "19:54",
      "sender": "steh",
      "type": "text",
      "content": "ta la no word",
      "description": ""
    },
    {
      "date": "17/06/2024",
      "hour": "19:54",
      "sender": "steh",
      "type": "text",
      "content": "quer q eu mande aqui?",
      "description": ""
    },
    {
      "date": "17/06/2024",
      "hour": "19:54",
      "sender": "lav",
      "type": "text",
      "content": "ia fortalecer se vc mandasse aqui",
      "description": ""
    },
    {
      "date": "17/06/2024",
      "hour": "19:56",
      "sender": "steh",
      "type": "text",
      "content": "Você sabia que após a pandemia de Covid-19, o Instituto Brasileiro de Geografia e Estatística (IBGE) identificou um crescimento de 4,9% no trabalho infantil no país? Aproximadamente 1,9 milhão de crianças estão tendo sua infância roubada pela exploração do trabalho infantil.",
      "description": ""
    },
    {
      "date": "17/06/2024",
      "hour": "19:56",
      "sender": "steh",
      "type": "text",
      "content": "ta ai",
      "description": ""
    },
    {
      "date": "17/06/2024",
      "hour": "19:57",
      "sender": "steh",
      "type": "text",
      "content": "po traduzi ai",
      "description": ""
    },
    {
      "date": "17/06/2024",
      "hour": "20:00",
      "sender": "lav",
      "type": "text",
      "content": "indo bebêr <Mensagem editada>",
      "description": ""
    },
    {
      "date": "17/06/2024",
      "hour": "20:01",
      "sender": "steh",
      "type": "text",
      "content": "vivencia veyr",
      "description": ""
    },
    {
      "date": "17/06/2024",
      "hour": "20:48",
      "sender": "lav",
      "type": "text",
      "content": "Did you know that after the covid-19 pandemic, the Brazilian Statistics Institute (IBGE) identified a raise of 4,9% of child labor in the country? About 1,9 million children are having their childhood and dreams stolen by the exploitation of child labor.",
      "description": ""
    },
    {
      "date": "21/06/2024",
      "hour": "08:09",
      "sender": "steh",
      "type": "image",
      "content": "00000231-PHOTO-2024-06-21-08-09-34.jpg",
      "description": ""
    },
    {
      "date": "21/06/2024",
      "hour": "08:09",
      "sender": "steh",
      "type": "image",
      "content": "00000232-PHOTO-2024-06-21-08-09-40.jpg",
      "description": ""
    },
    {
      "date": "21/06/2024",
      "hour": "08:59",
      "sender": "lav",
      "type": "image",
      "content": "00000233-PHOTO-2024-06-21-08-59-13.jpg",
      "description": ""
    },
    {
      "date": "21/06/2024",
      "hour": "08:59",
      "sender": "lav",
      "type": "image",
      "content": "00000234-PHOTO-2024-06-21-08-59-25.jpg",
      "description": ""
    },
    {
      "date": "22/06/2024",
      "hour": "22:45",
      "sender": "steh",
      "type": "text",
      "content": "lav lav",
      "description": ""
    },
    {
      "date": "22/06/2024",
      "hour": "23:25",
      "sender": "lav",
      "type": "text",
      "content": "oie",
      "description": ""
    },
    {
      "date": "23/06/2024",
      "hour": "11:06",
      "sender": "steh",
      "type": "text",
      "content": "eu mexi no texto de ingles",
      "description": ""
    },
    {
      "date": "23/06/2024",
      "hour": "11:06",
      "sender": "steh",
      "type": "text",
      "content": "c tu quiser traduzir",
      "description": ""
    },
    {
      "date": "25/06/2024",
      "hour": "07:06",
      "sender": "steh",
      "type": "text",
      "content": "lavinia",
      "description": ""
    },
    {
      "date": "25/06/2024",
      "hour": "07:34",
      "sender": "lav",
      "type": "text",
      "content": "oi",
      "description": ""
    },
    {
      "date": "25/06/2024",
      "hour": "09:07",
      "sender": "steh",
      "type": "text",
      "content": "lavinia",
      "description": ""
    },
    {
      "date": "25/06/2024",
      "hour": "09:07",
      "sender": "steh",
      "type": "text",
      "content": "seguinte",
      "description": ""
    },
    {
      "date": "25/06/2024",
      "hour": "09:07",
      "sender": "steh",
      "type": "text",
      "content": "preciso urgente",
      "description": ""
    },
    {
      "date": "25/06/2024",
      "hour": "09:07",
      "sender": "steh",
      "type": "text",
      "content": "do codigo que a gente fez no seu computador",
      "description": ""
    },
    {
      "date": "25/06/2024",
      "hour": "09:07",
      "sender": "steh",
      "type": "text",
      "content": "com a 3",
      "description": ""
    },
    {
      "date": "25/06/2024",
      "hour": "09:09",
      "sender": "lav",
      "type": "text",
      "content": "eu não tô em casa teteh",
      "description": ""
    },
    {
      "date": "25/06/2024",
      "hour": "09:09",
      "sender": "lav",
      "type": "sticker",
      "content": "00000247-STICKER-2024-06-25-09-09-48.webp",
      "description": ""
    },
    {
      "date": "25/06/2024",
      "hour": "09:10",
      "sender": "steh",
      "type": "text",
      "content": "mas c nao tqa nem com o computador?",
      "description": ""
    },
    {
      "date": "25/06/2024",
      "hour": "09:10",
      "sender": "steh",
      "type": "text",
      "content": "meu deusssssssssssss",
      "description": ""
    },
    {
      "date": "25/06/2024",
      "hour": "09:10",
      "sender": "lav",
      "type": "text",
      "content": "não",
      "description": ""
    },
    {
      "date": "25/06/2024",
      "hour": "09:10",
      "sender": "steh",
      "type": "text",
      "content": "meu deus do ceu lavinia",
      "description": ""
    },
    {
      "date": "25/06/2024",
      "hour": "09:10",
      "sender": "steh",
      "type": "text",
      "content": "estamos fodidas",
      "description": ""
    },
    {
      "date": "25/06/2024",
      "hour": "09:11",
      "sender": "steh",
      "type": "text",
      "content": "nem vou fazer",
      "description": ""
    },
    {
      "date": "25/06/2024",
      "hour": "09:11",
      "sender": "steh",
      "type": "text",
      "content": "solo",
      "description": ""
    },
    {
      "date": "25/06/2024",
      "hour": "09:11",
      "sender": "steh",
      "type": "text",
      "content": "um exec",
      "description": ""
    },
    {
      "date": "25/06/2024",
      "hour": "09:11",
      "sender": "lav",
      "type": "text",
      "content": "pedi pra minha mãe aqui",
      "description": ""
    },
    {
      "date": "25/06/2024",
      "hour": "09:17",
      "sender": "steh",
      "type": "text",
      "content": "ok",
      "description": ""
    },
    {
      "date": "25/06/2024",
      "hour": "09:31",
      "sender": "lav",
      "type": "text",
      "content": "TE MANDEI",
      "description": ""
    },
    {
      "date": "25/06/2024",
      "hour": "09:31",
      "sender": "lav",
      "type": "text",
      "content": "NO TEAMS",
      "description": ""
    },
    {
      "date": "25/06/2024",
      "hour": "09:45",
      "sender": "steh",
      "type": "text",
      "content": "nem da meu",
      "description": ""
    },
    {
      "date": "25/06/2024",
      "hour": "09:52",
      "sender": "lav",
      "type": "text",
      "content": "pq",
      "description": ""
    },
    {
      "date": "25/06/2024",
      "hour": "09:53",
      "sender": "steh",
      "type": "text",
      "content": "pq eu nao consigui",
      "description": ""
    },
    {
      "date": "25/06/2024",
      "hour": "09:53",
      "sender": "steh",
      "type": "text",
      "content": "e nem vou conseguir em meia hora",
      "description": ""
    },
    {
      "date": "25/06/2024",
      "hour": "17:15",
      "sender": "steh",
      "type": "text",
      "content": "lav",
      "description": ""
    },
    {
      "date": "25/06/2024",
      "hour": "17:23",
      "sender": "lav",
      "type": "text",
      "content": "oi vida",
      "description": ""
    },
    {
      "date": "25/06/2024",
      "hour": "17:29",
      "sender": "steh",
      "type": "audio",
      "content": "00000266-AUDIO-2024-06-25-17-29-44.opus",
      "description": "",
      "duration": null
    },
    {
      "date": "25/06/2024",
      "hour": "17:30",
      "sender": "lav",
      "type": "text",
      "content": "KAKAKAKKAKAKAKKAKAKAKKAKAKAKS NAO ACREDITO <Mensagem editada>",
      "description": ""
    },
    {
      "date": "25/06/2024",
      "hour": "17:30",
      "sender": "lav",
      "type": "text",
      "content": "QUE PENA CARA",
      "description": ""
    },
    {
      "date": "25/06/2024",
      "hour": "17:30",
      "sender": "lav",
      "type": "text",
      "content": "e acho que é só pedir na recepção pra fazer outro",
      "description": ""
    },
    {
      "date": "25/06/2024",
      "hour": "17:30",
      "sender": "lav",
      "type": "text",
      "content": "onde que vc perdeu?",
      "description": ""
    },
    {
      "date": "25/06/2024",
      "hour": "17:33",
      "sender": "steh",
      "type": "text",
      "content": "c eu soubesse ia la pegar ne",
      "description": ""
    },
    {
      "date": "25/06/2024",
      "hour": "17:33",
      "sender": "steh",
      "type": "text",
      "content": "aqui",
      "description": ""
    },
    {
      "date": "25/06/2024",
      "hour": "17:34",
      "sender": "lav",
      "type": "text",
      "content": "cavala",
      "description": ""
    },
    {
      "date": "25/06/2024",
      "hour": "17:34",
      "sender": "lav",
      "type": "text",
      "content": "perguntei pq pode ser na escola ou na picpay",
      "description": ""
    },
    {
      "date": "25/06/2024",
      "hour": "17:34",
      "sender": "lav",
      "type": "text",
      "content": "se for na Picpay procura por aí antes",
      "description": ""
    },
    {
      "date": "25/06/2024",
      "hour": "17:34",
      "sender": "lav",
      "type": "text",
      "content": "pergunta no grupo",
      "description": ""
    },
    {
      "date": "25/06/2024",
      "hour": "17:34",
      "sender": "steh",
      "type": "text",
      "content": "procurei",
      "description": ""
    },
    {
      "date": "25/06/2024",
      "hour": "17:34",
      "sender": "steh",
      "type": "text",
      "content": "tenho vergonha",
      "description": ""
    },
    {
      "date": "25/06/2024",
      "hour": "17:35",
      "sender": "steh",
      "type": "text",
      "content": "mas eu acho q deixei no banheiro",
      "description": ""
    },
    {
      "date": "25/06/2024",
      "hour": "17:35",
      "sender": "lav",
      "type": "text",
      "content": "então vai na recepção e pede",
      "description": ""
    },
    {
      "date": "25/06/2024",
      "hour": "18:50",
      "sender": "lav",
      "type": "text",
      "content": "caraca 5/11 posts do Instagram dele são com a mulher",
      "description": ""
    },
    {
      "date": "25/06/2024",
      "hour": "19:07",
      "sender": "steh",
      "type": "text",
      "content": "falei exatamente isso pro joao",
      "description": ""
    },
    {
      "date": "02/08/2024",
      "hour": "20:02",
      "sender": "steh",
      "type": "text",
      "content": "cheguei e viva",
      "description": ""
    },
    {
      "date": "02/08/2024",
      "hour": "20:04",
      "sender": "lav",
      "type": "text",
      "content": "UFAAA",
      "description": ""
    },
    {
      "date": "02/08/2024",
      "hour": "20:04",
      "sender": "lav",
      "type": "text",
      "content": "linda chegou cedinho que amor",
      "description": ""
    },
    {
      "date": "07/08/2024",
      "hour": "15:25",
      "sender": "steh",
      "type": "image",
      "content": "00000286-PHOTO-2024-08-07-15-25-35.jpg",
      "description": ""
    },
    {
      "date": "07/08/2024",
      "hour": "15:40",
      "sender": "lav",
      "type": "text",
      "content": "quanto de entrega?",
      "description": ""
    },
    {
      "date": "07/08/2024",
      "hour": "19:41",
      "sender": "steh",
      "type": "text",
      "content": "oi bb",
      "description": ""
    },
    {
      "date": "07/08/2024",
      "hour": "19:41",
      "sender": "steh",
      "type": "text",
      "content": "cheguei",
      "description": ""
    },
    {
      "date": "07/08/2024",
      "hour": "19:43",
      "sender": "lav",
      "type": "text",
      "content": "nossa rapidinho",
      "description": ""
    },
    {
      "date": "07/08/2024",
      "hour": "19:43",
      "sender": "lav",
      "type": "text",
      "content": "nem eu cheguei ainda",
      "description": ""
    },
    {
      "date": "07/08/2024",
      "hour": "19:43",
      "sender": "lav",
      "type": "text",
      "content": "beijo vida que bom que chegou bem",
      "description": ""
    },
    {
      "date": "07/08/2024",
      "hour": "19:43",
      "sender": "lav",
      "type": "sticker",
      "content": "00000293-STICKER-2024-08-07-19-43-44.webp",
      "description": ""
    },
    {
      "date": "07/08/2024",
      "hour": "19:48",
      "sender": "steh",
      "type": "text",
      "content": "carro ne bb",
      "description": ""
    },
    {
      "date": "07/08/2024",
      "hour": "19:48",
      "sender": "steh",
      "type": "text",
      "content": "c nao ir demorar uns anos",
      "description": ""
    },
    {
      "date": "09/08/2024",
      "hour": "20:11",
      "sender": "steh",
      "type": "text",
      "content": "cheguei",
      "description": ""
    },
    {
      "date": "09/08/2024",
      "hour": "20:18",
      "sender": "lav",
      "type": "sticker",
      "content": "00000297-STICKER-2024-08-09-20-18-47.webp",
      "description": ""
    },
    {
      "date": "12/08/2024",
      "hour": "20:39",
      "sender": "steh",
      "type": "text",
      "content": "MEU EX RESPIONDEIU MEU THR",
      "description": ""
    },
    {
      "date": "12/08/2024",
      "hour": "20:39",
      "sender": "steh",
      "type": "text",
      "content": "AI MEU DEUS",
      "description": ""
    },
    {
      "date": "12/08/2024",
      "hour": "20:39",
      "sender": "steh",
      "type": "text",
      "content": "OBG MERCÚRIO RETROGRADO",
      "description": ""
    },
    {
      "date": "12/08/2024",
      "hour": "20:39",
      "sender": "steh",
      "type": "text",
      "content": "vamos observar o insta",
      "description": ""
    },
    {
      "date": "12/08/2024",
      "hour": "20:39",
      "sender": "steh",
      "type": "text",
      "content": "ainda ta namirandooo",
      "description": ""
    },
    {
      "date": "12/08/2024",
      "hour": "20:40",
      "sender": "steh",
      "type": "text",
      "content": "nao vou nem responder de volta",
      "description": ""
    },
    {
      "date": "12/08/2024",
      "hour": "20:48",
      "sender": "lav",
      "type": "text",
      "content": "NEM FERRAND",
      "description": ""
    },
    {
      "date": "13/08/2024",
      "hour": "17:04",
      "sender": "steh",
      "type": "text",
      "content": "oi bb",
      "description": ""
    },
    {
      "date": "13/08/2024",
      "hour": "17:05",
      "sender": "steh",
      "type": "text",
      "content": "me manda aql troço la",
      "description": ""
    },
    {
      "date": "13/08/2024",
      "hour": "17:05",
      "sender": "steh",
      "type": "text",
      "content": "da aula de portugas",
      "description": ""
    },
    {
      "date": "13/08/2024",
      "hour": "17:05",
      "sender": "steh",
      "type": "text",
      "content": "pfv bb",
      "description": ""
    },
    {
      "date": "13/08/2024",
      "hour": "17:05",
      "sender": "steh",
      "type": "text",
      "content": "te amo",
      "description": ""
    },
    {
      "date": "13/08/2024",
      "hour": "17:27",
      "sender": "lav",
      "type": "image",
      "content": "00000310-PHOTO-2024-08-13-17-27-40.jpg",
      "description": ""
    },
    {
      "date": "13/08/2024",
      "hour": "17:27",
      "sender": "lav",
      "type": "video",
      "content": "00000311-VIDEO-2024-08-13-17-27-43.mp4",
      "description": ""
    },
    {
      "date": "13/08/2024",
      "hour": "17:27",
      "sender": "lav",
      "type": "image",
      "content": "00000312-PHOTO-2024-08-13-17-27-44.jpg",
      "description": ""
    },
    {
      "date": "13/08/2024",
      "hour": "17:27",
      "sender": "lav",
      "type": "image",
      "content": "00000313-PHOTO-2024-08-13-17-27-44.jpg",
      "description": ""
    },
    {
      "date": "13/08/2024",
      "hour": "17:27",
      "sender": "lav",
      "type": "image",
      "content": "00000314-PHOTO-2024-08-13-17-27-44.jpg",
      "description": ""
    },
    {
      "date": "13/08/2024",
      "hour": "17:27",
      "sender": "lav",
      "type": "image",
      "content": "00000315-PHOTO-2024-08-13-17-27-44.jpg",
      "description": ""
    },
    {
      "date": "13/08/2024",
      "hour": "20:45",
      "sender": "lav",
      "type": "text",
      "content": "O LUCAS WUE MANDOU MENSAGEM NO GRUPO DA FESTA É O IRMÃO DA GABI????",
      "description": ""
    },
    {
      "date": "13/08/2024",
      "hour": "20:46",
      "sender": "steh",
      "type": "text",
      "content": "EU IA FALAR ISSO AGR",
      "description": ""
    },
    {
      "date": "13/08/2024",
      "hour": "20:46",
      "sender": "steh",
      "type": "text",
      "content": "ACHO Q É",
      "description": ""
    },
    {
      "date": "13/08/2024",
      "hour": "20:46",
      "sender": "steh",
      "type": "text",
      "content": "ja pode mandar ele me beijar",
      "description": ""
    },
    {
      "date": "13/08/2024",
      "hour": "20:56",
      "sender": "steh",
      "type": "text",
      "content": "licença",
      "description": ""
    },
    {
      "date": "13/08/2024",
      "hour": "20:56",
      "sender": "steh",
      "type": "text",
      "content": "vc é o irmao da gabi?",
      "description": ""
    },
    {
      "date": "13/08/2024",
      "hour": "20:56",
      "sender": "steh",
      "type": "text",
      "content": "se sim",
      "description": ""
    },
    {
      "date": "13/08/2024",
      "hour": "20:56",
      "sender": "steh",
      "type": "text",
      "content": "me daria um beijo?",
      "description": ""
    },
    {
      "date": "13/08/2024",
      "hour": "20:58",
      "sender": "lav",
      "type": "text",
      "content": "KAJSKAJDKSKDJSKDKSKDJD MANDA",
      "description": ""
    },
    {
      "date": "13/08/2024",
      "hour": "21:19",
      "sender": "lav",
      "type": "text",
      "content": "LICENÇA VC É A MÃE DA GABI???",
      "description": ""
    },
    {
      "date": "15/08/2024",
      "hour": "20:22",
      "sender": "steh",
      "type": "text",
      "content": "cheguei",
      "description": ""
    },
    {
      "date": "15/08/2024",
      "hour": "20:55",
      "sender": "lav",
      "type": "text",
      "content": "linda bj",
      "description": ""
    },
    {
      "date": "16/08/2024",
      "hour": "20:20",
      "sender": "steh",
      "type": "text",
      "content": "https://vm.tiktok.com/ZMrGGPb3W/",
      "description": ""
    },
    {
      "date": "20/08/2024",
      "hour": "08:51",
      "sender": "lav",
      "type": "image",
      "content": "00000329-PHOTO-2024-08-20-08-51-36.jpg",
      "description": ""
    },
    {
      "date": "22/08/2024",
      "hour": "11:57",
      "sender": "steh",
      "type": "text",
      "content": "0625",
      "description": ""
    },
    {
      "date": "22/08/2024",
      "hour": "19:56",
      "sender": "steh",
      "type": "audio",
      "content": "00000331-AUDIO-2024-08-22-19-56-46.opus",
      "description": "",
      "duration": null
    },
    {
      "date": "22/08/2024",
      "hour": "23:02",
      "sender": "lav",
      "type": "text",
      "content": "AI QUE FOFA",
      "description": ""
    },
    {
      "date": "22/08/2024",
      "hour": "23:02",
      "sender": "lav",
      "type": "text",
      "content": "tomei coca com gelo e limão agorinha e lembrei de vc",
      "description": ""
    },
    {
      "date": "11/11/2024",
      "hour": "11:31",
      "sender": "steh",
      "type": "text",
      "content": "lavi",
      "description": ""
    },
    {
      "date": "11/11/2024",
      "hour": "11:31",
      "sender": "steh",
      "type": "text",
      "content": "avisa o joão que eu e a raika tamo fazendo um trbalho",
      "description": ""
    },
    {
      "date": "11/11/2024",
      "hour": "11:31",
      "sender": "steh",
      "type": "text",
      "content": "pfv",
      "description": ""
    },
    {
      "date": "14/11/2024",
      "hour": "15:44",
      "sender": "steh",
      "type": "text",
      "content": "lavinia",
      "description": ""
    },
    {
      "date": "14/11/2024",
      "hour": "15:45",
      "sender": "steh",
      "type": "text",
      "content": "qual o site da avv",
      "description": ""
    },
    {
      "date": "14/11/2024",
      "hour": "15:45",
      "sender": "lav",
      "type": "text",
      "content": "tá no outlook",
      "description": ""
    },
    {
      "date": "14/11/2024",
      "hour": "15:49",
      "sender": "steh",
      "type": "text",
      "content": "vlw diva",
      "description": ""
    },
    {
      "date": "14/11/2024",
      "hour": "19:58",
      "sender": "steh",
      "type": "text",
      "content": "tu vai fazer o video de sociologia?",
      "description": ""
    },
    {
      "date": "14/11/2024",
      "hour": "19:59",
      "sender": "steh",
      "type": "text",
      "content": "quer ajuda?",
      "description": ""
    },
    {
      "date": "14/11/2024",
      "hour": "20:32",
      "sender": "lav",
      "type": "text",
      "content": "quero",
      "description": ""
    },
    {
      "date": "14/11/2024",
      "hour": "20:32",
      "sender": "lav",
      "type": "text",
      "content": "tem que pedir os áudios.pra gabi",
      "description": ""
    },
    {
      "date": "15/11/2024",
      "hour": "22:14",
      "sender": "steh",
      "type": "text",
      "content": "pede ae",
      "description": ""
    },
    {
      "date": "15/11/2024",
      "hour": "22:14",
      "sender": "steh",
      "type": "text",
      "content": "A REBECA TA COM A CACHEADA QUE EU ERA APAIXONADA",
      "description": ""
    },
    {
      "date": "15/11/2024",
      "hour": "22:14",
      "sender": "steh",
      "type": "text",
      "content": "A BARBARA",
      "description": ""
    },
    {
      "date": "15/11/2024",
      "hour": "22:33",
      "sender": "lav",
      "type": "text",
      "content": "KAKAKAKAKAKKAKAKAKAKKAKAKAKAKSKSKKSKS",
      "description": ""
    },
    {
      "date": "15/11/2024",
      "hour": "22:33",
      "sender": "lav",
      "type": "text",
      "content": "aí como é lindo o rebuceteio",
      "description": ""
    },
    {
      "date": "17/11/2024",
      "hour": "09:48",
      "sender": "steh",
      "type": "text",
      "content": "lavinia",
      "description": ""
    },
    {
      "date": "17/11/2024",
      "hour": "10:28",
      "sender": "lav",
      "type": "text",
      "content": "oi",
      "description": ""
    },
    {
      "date": "17/11/2024",
      "hour": "10:52",
      "sender": "steh",
      "type": "text",
      "content": "vc começou q fazer sociologia?",
      "description": ""
    },
    {
      "date": "17/11/2024",
      "hour": "11:48",
      "sender": "lav",
      "type": "text",
      "content": "juntei todos os áudios já",
      "description": ""
    },
    {
      "date": "17/11/2024",
      "hour": "11:48",
      "sender": "lav",
      "type": "text",
      "content": "mas os desenhos eu não sei como faz não",
      "description": ""
    },
    {
      "date": "17/11/2024",
      "hour": "11:48",
      "sender": "lav",
      "type": "sticker",
      "content": "00000355-STICKER-2024-11-17-11-48-26.webp",
      "description": ""
    },
    {
      "date": "17/11/2024",
      "hour": "12:08",
      "sender": "steh",
      "type": "text",
      "content": "puta que pariu",
      "description": ""
    },
    {
      "date": "17/11/2024",
      "hour": "12:08",
      "sender": "steh",
      "type": "text",
      "content": "é pra hoje",
      "description": ""
    },
    {
      "date": "17/11/2024",
      "hour": "12:08",
      "sender": "steh",
      "type": "text",
      "content": "quer ajuda",
      "description": ""
    },
    {
      "date": "17/11/2024",
      "hour": "12:08",
      "sender": "steh",
      "type": "text",
      "content": "tipo",
      "description": ""
    },
    {
      "date": "17/11/2024",
      "hour": "12:08",
      "sender": "steh",
      "type": "text",
      "content": "pega uns elementos sla",
      "description": ""
    },
    {
      "date": "17/11/2024",
      "hour": "12:20",
      "sender": "lav",
      "type": "text",
      "content": "quero vei",
      "description": ""
    },
    {
      "date": "18/11/2024",
      "hour": "22:21",
      "sender": "lav",
      "type": "image",
      "content": "00000362-PHOTO-2024-11-18-22-21-54.jpg",
      "description": ""
    },
    {
      "date": "18/11/2024",
      "hour": "22:21",
      "sender": "lav",
      "type": "image",
      "content": "00000363-PHOTO-2024-11-18-22-21-54.jpg",
      "description": ""
    },
    {
      "date": "19/11/2024",
      "hour": "07:09",
      "sender": "steh",
      "type": "text",
      "content": "lavinia",
      "description": ""
    },
    {
      "date": "19/11/2024",
      "hour": "07:09",
      "sender": "steh",
      "type": "text",
      "content": "cadê a sua parte do vídeo",
      "description": ""
    },
    {
      "date": "21/11/2024",
      "hour": "18:33",
      "sender": "steh",
      "type": "text",
      "content": "Ligação de voz. 26 segundos",
      "description": ""
    },
    {
      "date": "21/11/2024",
      "hour": "18:34",
      "sender": "lav",
      "type": "text",
      "content": "quem é esse do seu lado",
      "description": ""
    },
    {
      "date": "21/11/2024",
      "hour": "18:34",
      "sender": "lav",
      "type": "sticker",
      "content": "00000368-STICKER-2024-11-21-18-34-15.webp",
      "description": ""
    },
    {
      "date": "23/11/2024",
      "hour": "19:45",
      "sender": "steh",
      "type": "text",
      "content": "falei com a rebeca",
      "description": ""
    },
    {
      "date": "23/11/2024",
      "hour": "19:45",
      "sender": "steh",
      "type": "text",
      "content": "desculpa",
      "description": ""
    },
    {
      "date": "23/11/2024",
      "hour": "21:06",
      "sender": "lav",
      "type": "sticker",
      "content": "00000371-STICKER-2024-11-23-21-06-24.webp",
      "description": ""
    },
    {
      "date": "23/11/2024",
      "hour": "21:06",
      "sender": "lav",
      "type": "text",
      "content": "pelo amor de deus",
      "description": ""
    },
    {
      "date": "23/11/2024",
      "hour": "21:06",
      "sender": "lav",
      "type": "text",
      "content": "falou oq?",
      "description": ""
    },
    {
      "date": "23/11/2024",
      "hour": "21:15",
      "sender": "steh",
      "type": "text",
      "content": "ela",
      "description": ""
    },
    {
      "date": "23/11/2024",
      "hour": "21:15",
      "sender": "steh",
      "type": "text",
      "content": "com um beijo",
      "description": ""
    },
    {
      "date": "23/11/2024",
      "hour": "21:15",
      "sender": "steh",
      "type": "text",
      "content": "e a mão na minha cintura",
      "description": ""
    },
    {
      "date": "23/11/2024",
      "hour": "22:01",
      "sender": "lav",
      "type": "sticker",
      "content": "00000377-STICKER-2024-11-23-22-01-59.webp",
      "description": ""
    },
    {
      "date": "23/11/2024",
      "hour": "22:02",
      "sender": "lav",
      "type": "text",
      "content": "ela não tava com a menina lá?",
      "description": ""
    },
    {
      "date": "23/11/2024",
      "hour": "22:25",
      "sender": "steh",
      "type": "text",
      "content": "pois é",
      "description": ""
    },
    {
      "date": "24/11/2024",
      "hour": "21:20",
      "sender": "steh",
      "type": "text",
      "content": "manda a ft do texto vidoca",
      "description": ""
    },
    {
      "date": "24/11/2024",
      "hour": "21:50",
      "sender": "lav",
      "type": "image",
      "content": "00000381-PHOTO-2024-11-24-21-50-14.jpg",
      "description": ""
    },
    {
      "date": "24/11/2024",
      "hour": "21:50",
      "sender": "lav",
      "type": "image",
      "content": "00000382-PHOTO-2024-11-24-21-50-14.jpg",
      "description": ""
    },
    {
      "date": "28/11/2024",
      "hour": "08:37",
      "sender": "steh",
      "type": "text",
      "content": "tu ficou de rec em alguma?",
      "description": ""
    },
    {
      "date": "28/11/2024",
      "hour": "08:48",
      "sender": "lav",
      "type": "text",
      "content": "nop",
      "description": ""
    },
    {
      "date": "28/11/2024",
      "hour": "08:48",
      "sender": "lav",
      "type": "text",
      "content": "e vc?",
      "description": ""
    },
    {
      "date": "28/11/2024",
      "hour": "08:48",
      "sender": "steh",
      "type": "text",
      "content": "devops",
      "description": ""
    },
    {
      "date": "28/11/2024",
      "hour": "08:48",
      "sender": "steh",
      "type": "text",
      "content": "porra do caralho",
      "description": ""
    },
    {
      "date": "28/11/2024",
      "hour": "08:48",
      "sender": "lav",
      "type": "text",
      "content": "porra porra porra",
      "description": ""
    },
    {
      "date": "28/11/2024",
      "hour": "08:48",
      "sender": "lav",
      "type": "text",
      "content": "vc consegue amor",
      "description": ""
    },
    {
      "date": "28/11/2024",
      "hour": "08:50",
      "sender": "steh",
      "type": "text",
      "content": "amiga nem na escola eu cheguei",
      "description": ""
    },
    {
      "date": "28/11/2024",
      "hour": "08:50",
      "sender": "steh",
      "type": "text",
      "content": "pq ta um puta trânsito na mutinga",
      "description": ""
    },
    {
      "date": "28/11/2024",
      "hour": "08:52",
      "sender": "lav",
      "type": "text",
      "content": "eita",
      "description": ""
    },
    {
      "date": "28/11/2024",
      "hour": "08:52",
      "sender": "lav",
      "type": "text",
      "content": "mas que horas é a rec?",
      "description": ""
    },
    {
      "date": "28/11/2024",
      "hour": "08:52",
      "sender": "steh",
      "type": "text",
      "content": "amiga",
      "description": ""
    },
    {
      "date": "28/11/2024",
      "hour": "08:53",
      "sender": "steh",
      "type": "text",
      "content": "9",
      "description": ""
    },
    {
      "date": "28/11/2024",
      "hour": "08:53",
      "sender": "steh",
      "type": "text",
      "content": "to a uma hora e meia na porra do carro",
      "description": ""
    },
    {
      "date": "28/11/2024",
      "hour": "08:53",
      "sender": "steh",
      "type": "text",
      "content": "como isso é possível",
      "description": ""
    },
    {
      "date": "28/11/2024",
      "hour": "08:53",
      "sender": "lav",
      "type": "text",
      "content": "KAKAKAKAKAKKAKAKAKAKAKAKAKAKAKKAKAKAKAKAKAKAKKAKAKA",
      "description": ""
    },
    {
      "date": "30/11/2024",
      "hour": "22:32",
      "sender": "lav",
      "type": "image",
      "content": "00000399-PHOTO-2024-11-30-22-32-09.jpg",
      "description": ""
    },
    {
      "date": "30/11/2024",
      "hour": "22:41",
      "sender": "steh",
      "type": "text",
      "content": "amiga",
      "description": ""
    },
    {
      "date": "30/11/2024",
      "hour": "22:42",
      "sender": "steh",
      "type": "image",
      "content": "00000401-PHOTO-2024-11-30-22-42-25.jpg",
      "description": ""
    },
    {
      "date": "30/11/2024",
      "hour": "22:42",
      "sender": "steh",
      "type": "text",
      "content": "acho que a gente se completa",
      "description": ""
    },
    {
      "date": "30/11/2024",
      "hour": "22:42",
      "sender": "lav",
      "type": "text",
      "content": "AI QUE FOFINHOOO",
      "description": ""
    },
    {
      "date": "30/11/2024",
      "hour": "23:06",
      "sender": "steh",
      "type": "text",
      "content": "eu sei",
      "description": ""
    },
    {
      "date": "30/11/2024",
      "hour": "23:06",
      "sender": "steh",
      "type": "text",
      "content": "calma c",
      "description": ""
    },
    {
      "date": "30/11/2024",
      "hour": "23:06",
      "sender": "steh",
      "type": "text",
      "content": "é a marceli",
      "description": ""
    },
    {
      "date": "30/11/2024",
      "hour": "23:06",
      "sender": "steh",
      "type": "text",
      "content": "?",
      "description": ""
    },
    {
      "date": "01/12/2024",
      "hour": "00:02",
      "sender": "lav",
      "type": "text",
      "content": "É MANO",
      "description": ""
    },
    {
      "date": "01/12/2024",
      "hour": "00:27",
      "sender": "steh",
      "type": "text",
      "content": "MEU DEUS",
      "description": ""
    },
    {
      "date": "01/12/2024",
      "hour": "00:28",
      "sender": "steh",
      "type": "text",
      "content": "ai amiga",
      "description": ""
    },
    {
      "date": "01/12/2024",
      "hour": "00:28",
      "sender": "steh",
      "type": "text",
      "content": "o boca ta terminando oq a gente não tem",
      "description": ""
    },
    {
      "date": "01/12/2024",
      "hour": "00:28",
      "sender": "steh",
      "type": "text",
      "content": "eu to ficano maluca",
      "description": ""
    },
    {
      "date": "01/12/2024",
      "hour": "00:28",
      "sender": "steh",
      "type": "text",
      "content": "pq ele acabou de me dar uma love bombing",
      "description": ""
    },
    {
      "date": "01/12/2024",
      "hour": "00:28",
      "sender": "steh",
      "type": "text",
      "content": "ai odeio esse termo",
      "description": ""
    },
    {
      "date": "01/12/2024",
      "hour": "00:28",
      "sender": "steh",
      "type": "text",
      "content": "ai tipo",
      "description": ""
    },
    {
      "date": "01/12/2024",
      "hour": "00:28",
      "sender": "steh",
      "type": "text",
      "content": "eu fui e falei tipo",
      "description": ""
    },
    {
      "date": "01/12/2024",
      "hour": "00:28",
      "sender": "steh",
      "type": "text",
      "content": "vc ta esquisito",
      "description": ""
    },
    {
      "date": "01/12/2024",
      "hour": "00:28",
      "sender": "steh",
      "type": "text",
      "content": "ai ele meteu tipo um",
      "description": ""
    },
    {
      "date": "01/12/2024",
      "hour": "00:29",
      "sender": "steh",
      "type": "text",
      "content": "ai é coisa da sua cabeça e tals",
      "description": ""
    },
    {
      "date": "01/12/2024",
      "hour": "00:29",
      "sender": "steh",
      "type": "text",
      "content": "ai ele foi e falou tipo",
      "description": ""
    },
    {
      "date": "01/12/2024",
      "hour": "00:29",
      "sender": "steh",
      "type": "text",
      "content": "olha",
      "description": ""
    },
    {
      "date": "01/12/2024",
      "hour": "00:29",
      "sender": "steh",
      "type": "image",
      "content": "00000422-PHOTO-2024-12-01-00-29-28.jpg",
      "description": ""
    },
    {
      "date": "01/12/2024",
      "hour": "00:29",
      "sender": "steh",
      "type": "text",
      "content": "ai eu fiquei tipo",
      "description": ""
    },
    {
      "date": "01/12/2024",
      "hour": "00:29",
      "sender": "steh",
      "type": "text",
      "content": "😧",
      "description": ""
    },
    {
      "date": "01/12/2024",
      "hour": "00:30",
      "sender": "steh",
      "type": "text",
      "content": "e ai eu comecei a me humilhar",
      "description": ""
    },
    {
      "date": "01/12/2024",
      "hour": "00:30",
      "sender": "steh",
      "type": "text",
      "content": "mas chegou uma hora que eu pensei",
      "description": ""
    },
    {
      "date": "01/12/2024",
      "hour": "00:30",
      "sender": "steh",
      "type": "text",
      "content": "tipo",
      "description": ""
    },
    {
      "date": "01/12/2024",
      "hour": "00:31",
      "sender": "steh",
      "type": "text",
      "content": "não sou eu que tenho que me humilhar",
      "description": ""
    },
    {
      "date": "01/12/2024",
      "hour": "00:31",
      "sender": "steh",
      "type": "text",
      "content": "eu que sou a legal",
      "description": ""
    },
    {
      "date": "01/12/2024",
      "hour": "00:31",
      "sender": "steh",
      "type": "text",
      "content": "a engraçada",
      "description": ""
    },
    {
      "date": "01/12/2024",
      "hour": "00:31",
      "sender": "steh",
      "type": "text",
      "content": "a bonita",
      "description": ""
    },
    {
      "date": "01/12/2024",
      "hour": "00:31",
      "sender": "steh",
      "type": "text",
      "content": "e a q ele tem que correr atras",
      "description": ""
    },
    {
      "date": "01/12/2024",
      "hour": "00:31",
      "sender": "steh",
      "type": "text",
      "content": "ai eu descasquei ele e mandei um",
      "description": ""
    },
    {
      "date": "01/12/2024",
      "hour": "00:31",
      "sender": "steh",
      "type": "text",
      "content": "passar bem",
      "description": ""
    },
    {
      "date": "01/12/2024",
      "hour": "00:31",
      "sender": "steh",
      "type": "image",
      "content": "00000435-PHOTO-2024-12-01-00-31-52.jpg",
      "description": ""
    },
    {
      "date": "01/12/2024",
      "hour": "01:28",
      "sender": "lav",
      "type": "text",
      "content": "EXACTLY",
      "description": ""
    },
    {
      "date": "01/12/2024",
      "hour": "01:28",
      "sender": "lav",
      "type": "text",
      "content": "vc tá certa",
      "description": ""
    },
    {
      "date": "01/12/2024",
      "hour": "01:28",
      "sender": "lav",
      "type": "text",
      "content": "n sei nem pq vc começou a se humilhar",
      "description": ""
    },
    {
      "date": "01/12/2024",
      "hour": "01:28",
      "sender": "lav",
      "type": "text",
      "content": "vcs nem tem nada",
      "description": ""
    },
    {
      "date": "01/12/2024",
      "hour": "14:17",
      "sender": "steh",
      "type": "text",
      "content": "pois é",
      "description": ""
    },
    {
      "date": "01/12/2024",
      "hour": "15:10",
      "sender": "steh",
      "type": "image",
      "content": "00000441-PHOTO-2024-12-01-15-10-41.jpg",
      "description": ""
    },
    {
      "date": "01/12/2024",
      "hour": "15:13",
      "sender": "steh",
      "type": "text",
      "content": "imagem ocultada",
      "description": ""
    },
    {
      "date": "01/12/2024",
      "hour": "15:51",
      "sender": "lav",
      "type": "text",
      "content": "qual maturidade que vc não tem",
      "description": ""
    },
    {
      "date": "01/12/2024",
      "hour": "15:51",
      "sender": "lav",
      "type": "text",
      "content": "oxi",
      "description": ""
    },
    {
      "date": "01/12/2024",
      "hour": "16:10",
      "sender": "steh",
      "type": "text",
      "content": "amiga eu tenho total",
      "description": ""
    },
    {
      "date": "01/12/2024",
      "hour": "16:10",
      "sender": "steh",
      "type": "text",
      "content": "🔥🫦",
      "description": ""
    },
    {
      "date": "01/12/2024",
      "hour": "16:29",
      "sender": "steh",
      "type": "text",
      "content": "ele falou que foi trabalhar presencial por minha causa",
      "description": ""
    },
    {
      "date": "01/12/2024",
      "hour": "16:29",
      "sender": "steh",
      "type": "text",
      "content": "amoleceu meu coração",
      "description": ""
    },
    {
      "date": "01/12/2024",
      "hour": "16:29",
      "sender": "steh",
      "type": "text",
      "content": "nunca trabalharia presencial por alguém",
      "description": ""
    },
    {
      "date": "01/12/2024",
      "hour": "16:29",
      "sender": "steh",
      "type": "text",
      "content": "a não ser pelo meu chefe e meu salário",
      "description": ""
    },
    {
      "date": "01/12/2024",
      "hour": "16:34",
      "sender": "steh",
      "type": "text",
      "content": "to ansiosa pro meu vestido de formatura",
      "description": ""
    },
    {
      "date": "01/12/2024",
      "hour": "16:34",
      "sender": "steh",
      "type": "text",
      "content": "affs",
      "description": ""
    },
    {
      "date": "01/12/2024",
      "hour": "17:25",
      "sender": "lav",
      "type": "text",
      "content": "KAKAKKAAKAKAKKAKAKAKAKAKAK",
      "description": ""
    },
    {
      "date": "01/12/2024",
      "hour": "17:25",
      "sender": "lav",
      "type": "text",
      "content": "AI EU TBM",
      "description": ""
    },
    {
      "date": "01/12/2024",
      "hour": "17:25",
      "sender": "lav",
      "type": "text",
      "content": "o da Rafa lindíssimo",
      "description": ""
    },
    {
      "date": "02/12/2024",
      "hour": "12:21",
      "sender": "steh",
      "type": "audio",
      "content": "00000456-AUDIO-2024-12-02-12-21-57.opus",
      "description": "",
      "duration": null
    },
    {
      "date": "02/12/2024",
      "hour": "12:28",
      "sender": "steh",
      "type": "text",
      "content": "tamo no mesmo vagão",
      "description": ""
    },
    {
      "date": "02/12/2024",
      "hour": "12:28",
      "sender": "steh",
      "type": "text",
      "content": "minha mãe vai me pegar na barra funda",
      "description": ""
    },
    {
      "date": "02/12/2024",
      "hour": "12:28",
      "sender": "steh",
      "type": "text",
      "content": "affs",
      "description": ""
    },
    {
      "date": "02/12/2024",
      "hour": "12:29",
      "sender": "steh",
      "type": "text",
      "content": "nao vamos pra casa juntos",
      "description": ""
    },
    {
      "date": "02/12/2024",
      "hour": "12:40",
      "sender": "steh",
      "type": "text",
      "content": "ele ta na minha frente",
      "description": ""
    },
    {
      "date": "05/12/2024",
      "hour": "12:44",
      "sender": "steh",
      "type": "text",
      "content": "to no trem com ele",
      "description": ""
    },
    {
      "date": "05/12/2024",
      "hour": "12:44",
      "sender": "steh",
      "type": "text",
      "content": "sem querer",
      "description": ""
    },
    {
      "date": "05/12/2024",
      "hour": "12:44",
      "sender": "steh",
      "type": "text",
      "content": "e no mesmo vagão",
      "description": ""
    },
    {
      "date": "05/12/2024",
      "hour": "12:44",
      "sender": "steh",
      "type": "text",
      "content": "eu olhei pro lado vi um simbolo gigante da picpay",
      "description": ""
    },
    {
      "date": "05/12/2024",
      "hour": "12:44",
      "sender": "steh",
      "type": "text",
      "content": "ai eu falei ué",
      "description": ""
    },
    {
      "date": "05/12/2024",
      "hour": "13:01",
      "sender": "lav",
      "type": "text",
      "content": "KAKAKAKAJAKAKAKAKAKA",
      "description": ""
    },
    {
      "date": "05/12/2024",
      "hour": "13:01",
      "sender": "lav",
      "type": "text",
      "content": "já falei pra puxar assunto",
      "description": ""
    },
    {
      "date": "05/12/2024",
      "hour": "13:01",
      "sender": "steh",
      "type": "text",
      "content": "amiga ele n desse em pirituba",
      "description": ""
    },
    {
      "date": "05/12/2024",
      "hour": "13:01",
      "sender": "steh",
      "type": "text",
      "content": "ele desce no piqueri",
      "description": ""
    },
    {
      "date": "05/12/2024",
      "hour": "13:01",
      "sender": "steh",
      "type": "text",
      "content": "que é pior ainda",
      "description": ""
    },
    {
      "date": "05/12/2024",
      "hour": "13:19",
      "sender": "lav",
      "type": "text",
      "content": "KAKAKAKAKAKAKAKAKAKKAKAKAKAKSKSKAKAKKAKAS",
      "description": ""
    },
    {
      "date": "05/12/2024",
      "hour": "13:19",
      "sender": "lav",
      "type": "text",
      "content": "pelo amor de deus",
      "description": ""
    },
    {
      "date": "05/12/2024",
      "hour": "13:20",
      "sender": "lav",
      "type": "text",
      "content": "um fudido desse",
      "description": ""
    },
    {
      "date": "05/12/2024",
      "hour": "13:20",
      "sender": "lav",
      "type": "text",
      "content": "por isso que ele andava na van com caixa de som",
      "description": ""
    },
    {
      "date": "13/12/2024",
      "hour": "08:20",
      "sender": "steh",
      "type": "text",
      "content": "nao acredito nisso",
      "description": ""
    },
    {
      "date": "13/12/2024",
      "hour": "08:20",
      "sender": "steh",
      "type": "text",
      "content": "vc tava de mao dada",
      "description": ""
    },
    {
      "date": "13/12/2024",
      "hour": "08:20",
      "sender": "steh",
      "type": "text",
      "content": "com a sifia",
      "description": ""
    },
    {
      "date": "13/12/2024",
      "hour": "08:20",
      "sender": "steh",
      "type": "text",
      "content": "na festa",
      "description": ""
    },
    {
      "date": "13/12/2024",
      "hour": "08:20",
      "sender": "steh",
      "type": "text",
      "content": "c n tem vergonha na cara nao?",
      "description": ""
    },
    {
      "date": "13/12/2024",
      "hour": "10:27",
      "sender": "lav",
      "type": "text",
      "content": "OXI",
      "description": ""
    },
    {
      "date": "13/12/2024",
      "hour": "10:27",
      "sender": "lav",
      "type": "sticker",
      "content": "00000482-STICKER-2024-12-13-10-27-10.webp",
      "description": ""
    },
    {
      "date": "14/12/2024",
      "hour": "19:08",
      "sender": "steh",
      "type": "text",
      "content": "quero reclaramr",
      "description": ""
    },
    {
      "date": "14/12/2024",
      "hour": "19:09",
      "sender": "steh",
      "type": "text",
      "content": "e vc é a unica coisa que eu posso falsr",
      "description": ""
    },
    {
      "date": "14/12/2024",
      "hour": "19:09",
      "sender": "steh",
      "type": "text",
      "content": "pessoa no caso",
      "description": ""
    },
    {
      "date": "14/12/2024",
      "hour": "19:17",
      "sender": "steh",
      "type": "text",
      "content": "imagem ocultada",
      "description": ""
    },
    {
      "date": "14/12/2024",
      "hour": "19:35",
      "sender": "lav",
      "type": "text",
      "content": "de vela pra quem?",
      "description": ""
    },
    {
      "date": "14/12/2024",
      "hour": "19:39",
      "sender": "steh",
      "type": "text",
      "content": "duvido",
      "description": ""
    },
    {
      "date": "14/12/2024",
      "hour": "19:39",
      "sender": "steh",
      "type": "text",
      "content": "duvido vc adivinhar",
      "description": ""
    },
    {
      "date": "14/12/2024",
      "hour": "19:40",
      "sender": "lav",
      "type": "text",
      "content": "aí não acredito",
      "description": ""
    },
    {
      "date": "14/12/2024",
      "hour": "19:40",
      "sender": "lav",
      "type": "text",
      "content": "mas ele é burrinho tbm",
      "description": ""
    },
    {
      "date": "14/12/2024",
      "hour": "19:41",
      "sender": "steh",
      "type": "text",
      "content": "ai eu to ficando maluca",
      "description": ""
    },
    {
      "date": "14/12/2024",
      "hour": "19:41",
      "sender": "steh",
      "type": "text",
      "content": "desculpa",
      "description": ""
    },
    {
      "date": "14/12/2024",
      "hour": "19:41",
      "sender": "steh",
      "type": "text",
      "content": "mas ela bao quer",
      "description": ""
    },
    {
      "date": "14/12/2024",
      "hour": "19:41",
      "sender": "steh",
      "type": "text",
      "content": "ai ela quer",
      "description": ""
    },
    {
      "date": "14/12/2024",
      "hour": "19:41",
      "sender": "steh",
      "type": "text",
      "content": "ai ela nao quer",
      "description": ""
    },
    {
      "date": "14/12/2024",
      "hour": "19:41",
      "sender": "steh",
      "type": "text",
      "content": "ai quer",
      "description": ""
    },
    {
      "date": "14/12/2024",
      "hour": "19:41",
      "sender": "steh",
      "type": "text",
      "content": "mas sabe oq é esquisito",
      "description": ""
    },
    {
      "date": "14/12/2024",
      "hour": "19:56",
      "sender": "lav",
      "type": "text",
      "content": "oq?",
      "description": ""
    },
    {
      "date": "14/12/2024",
      "hour": "19:57",
      "sender": "lav",
      "type": "text",
      "content": "ela quer é uma pica bem grossa",
      "description": ""
    },
    {
      "date": "14/12/2024",
      "hour": "20:13",
      "sender": "steh",
      "type": "text",
      "content": "ai amiga quem não quer",
      "description": ""
    },
    {
      "date": "14/12/2024",
      "hour": "20:15",
      "sender": "steh",
      "type": "text",
      "content": "eu to com um sentimento ruim",
      "description": ""
    },
    {
      "date": "14/12/2024",
      "hour": "20:15",
      "sender": "steh",
      "type": "text",
      "content": "mas ai que ta",
      "description": ""
    },
    {
      "date": "14/12/2024",
      "hour": "20:16",
      "sender": "steh",
      "type": "text",
      "content": "nao falei isso nem pra livia então total segredo",
      "description": ""
    },
    {
      "date": "14/12/2024",
      "hour": "20:16",
      "sender": "steh",
      "type": "text",
      "content": "sera que eu tenho uma queda nele?",
      "description": ""
    },
    {
      "date": "14/12/2024",
      "hour": "20:16",
      "sender": "steh",
      "type": "text",
      "content": "ou ele é só um homem",
      "description": ""
    },
    {
      "date": "14/12/2024",
      "hour": "20:16",
      "sender": "steh",
      "type": "text",
      "content": "sabe",
      "description": ""
    },
    {
      "date": "14/12/2024",
      "hour": "20:16",
      "sender": "steh",
      "type": "text",
      "content": "ou eu so sou uma vadia que ten inveja",
      "description": ""
    },
    {
      "date": "14/12/2024",
      "hour": "21:18",
      "sender": "lav",
      "type": "text",
      "content": "eu não quero",
      "description": ""
    },
    {
      "date": "14/12/2024",
      "hour": "21:18",
      "sender": "lav",
      "type": "text",
      "content": "AI MDS",
      "description": ""
    },
    {
      "date": "14/12/2024",
      "hour": "21:19",
      "sender": "lav",
      "type": "text",
      "content": "será que vcs são tipo aqueles filmes clichês de melhor amigo que no final gostam um do outro",
      "description": ""
    },
    {
      "date": "14/12/2024",
      "hour": "21:19",
      "sender": "lav",
      "type": "text",
      "content": "é uma possibilidade tbm",
      "description": ""
    },
    {
      "date": "14/12/2024",
      "hour": "21:25",
      "sender": "steh",
      "type": "text",
      "content": "amiga",
      "description": ""
    },
    {
      "date": "14/12/2024",
      "hour": "21:25",
      "sender": "steh",
      "type": "text",
      "content": "nos nao somos",
      "description": ""
    },
    {
      "date": "14/12/2024",
      "hour": "21:25",
      "sender": "steh",
      "type": "text",
      "content": "pq c isso tiver acontecendo é só pela minha parte",
      "description": ""
    },
    {
      "date": "14/12/2024",
      "hour": "21:25",
      "sender": "steh",
      "type": "text",
      "content": "mas sla",
      "description": ""
    },
    {
      "date": "14/12/2024",
      "hour": "21:25",
      "sender": "steh",
      "type": "text",
      "content": "a gente foi na feirinha da praia",
      "description": ""
    },
    {
      "date": "14/12/2024",
      "hour": "21:26",
      "sender": "steh",
      "type": "text",
      "content": "e ele me comprou uma tornozeleira",
      "description": ""
    },
    {
      "date": "14/12/2024",
      "hour": "21:26",
      "sender": "steh",
      "type": "text",
      "content": "combinando com ele",
      "description": ""
    },
    {
      "date": "14/12/2024",
      "hour": "21:26",
      "sender": "steh",
      "type": "text",
      "content": "e me deu de presnete",
      "description": ""
    },
    {
      "date": "14/12/2024",
      "hour": "21:26",
      "sender": "steh",
      "type": "text",
      "content": "mas isso seria so amizade ou ele me ama na escondida",
      "description": ""
    },
    {
      "date": "14/12/2024",
      "hour": "22:10",
      "sender": "lav",
      "type": "text",
      "content": "ou ele é um amigo MUITO carinhoso ou ele te ama na escondida",
      "description": ""
    },
    {
      "date": "14/12/2024",
      "hour": "22:11",
      "sender": "lav",
      "type": "text",
      "content": "pq acho que nenhum dos meus amigos me compraria uma tornozeleira combinando",
      "description": ""
    },
    {
      "date": "14/12/2024",
      "hour": "23:04",
      "sender": "steh",
      "type": "text",
      "content": "amiga acgo que ele so é carinhoso",
      "description": ""
    },
    {
      "date": "14/12/2024",
      "hour": "23:04",
      "sender": "steh",
      "type": "text",
      "content": "tipo",
      "description": ""
    },
    {
      "date": "14/12/2024",
      "hour": "23:05",
      "sender": "steh",
      "type": "text",
      "content": "ele nao me deu dando",
      "description": ""
    },
    {
      "date": "14/12/2024",
      "hour": "23:05",
      "sender": "steh",
      "type": "text",
      "content": "ele mandou embrulhar pra presentinhk sabe",
      "description": ""
    },
    {
      "date": "14/12/2024",
      "hour": "23:09",
      "sender": "steh",
      "type": "text",
      "content": "a nao sei",
      "description": ""
    },
    {
      "date": "14/12/2024",
      "hour": "23:09",
      "sender": "steh",
      "type": "text",
      "content": "quer ver?",
      "description": ""
    },
    {
      "date": "14/12/2024",
      "hour": "23:09",
      "sender": "steh",
      "type": "text",
      "content": "as duas são iguais",
      "description": ""
    },
    {
      "date": "14/12/2024",
      "hour": "23:10",
      "sender": "steh",
      "type": "text",
      "content": "a dele é preta e a minha é bege",
      "description": ""
    },
    {
      "date": "14/12/2024",
      "hour": "23:19",
      "sender": "lav",
      "type": "text",
      "content": "quero",
      "description": ""
    },
    {
      "date": "14/12/2024",
      "hour": "23:19",
      "sender": "lav",
      "type": "sticker",
      "content": "00000533-STICKER-2024-12-14-23-19-30.webp",
      "description": ""
    },
    {
      "date": "14/12/2024",
      "hour": "23:19",
      "sender": "lav",
      "type": "text",
      "content": "não sei acho que pode ter algo acontecendo <Mensagem editada>",
      "description": ""
    },
    {
      "date": "14/12/2024",
      "hour": "23:21",
      "sender": "steh",
      "type": "text",
      "content": "ta calma",
      "description": ""
    },
    {
      "date": "14/12/2024",
      "hour": "23:22",
      "sender": "steh",
      "type": "text",
      "content": "mas amiga",
      "description": ""
    },
    {
      "date": "14/12/2024",
      "hour": "23:22",
      "sender": "steh",
      "type": "text",
      "content": "ele é muito meu amigi sabe",
      "description": ""
    },
    {
      "date": "14/12/2024",
      "hour": "23:22",
      "sender": "steh",
      "type": "text",
      "content": "e se não for nada",
      "description": ""
    },
    {
      "date": "14/12/2024",
      "hour": "23:24",
      "sender": "steh",
      "type": "text",
      "content": "vou mandar a minha e a dele",
      "description": ""
    },
    {
      "date": "14/12/2024",
      "hour": "23:35",
      "sender": "steh",
      "type": "video",
      "content": "00000540-VIDEO-2024-12-14-23-35-19.mp4",
      "description": ""
    },
    {
      "date": "14/12/2024",
      "hour": "23:42",
      "sender": "steh",
      "type": "text",
      "content": "da uma olhada",
      "description": ""
    },
    {
      "date": "14/12/2024",
      "hour": "23:42",
      "sender": "steh",
      "type": "text",
      "content": "ve oq vc acha",
      "description": ""
    },
    {
      "date": "14/12/2024",
      "hour": "23:42",
      "sender": "steh",
      "type": "text",
      "content": "pq tipo sla",
      "description": ""
    },
    {
      "date": "14/12/2024",
      "hour": "23:43",
      "sender": "steh",
      "type": "text",
      "content": "ele ta claramente dando encima da raika sabe",
      "description": ""
    },
    {
      "date": "14/12/2024",
      "hour": "23:43",
      "sender": "steh",
      "type": "text",
      "content": "mas sla é isso",
      "description": ""
    },
    {
      "date": "14/12/2024",
      "hour": "23:48",
      "sender": "steh",
      "type": "text",
      "content": "tipo",
      "description": ""
    },
    {
      "date": "14/12/2024",
      "hour": "23:48",
      "sender": "steh",
      "type": "text",
      "content": "ele sentou do lado dela sabe",
      "description": ""
    },
    {
      "date": "14/12/2024",
      "hour": "23:49",
      "sender": "steh",
      "type": "text",
      "content": "eu acho q foi só um gesto de carinho",
      "description": ""
    },
    {
      "date": "14/12/2024",
      "hour": "23:55",
      "sender": "steh",
      "type": "text",
      "content": "ai lavinia vou aproveitar q vc n responde e desabafar",
      "description": ""
    },
    {
      "date": "14/12/2024",
      "hour": "23:55",
      "sender": "steh",
      "type": "text",
      "content": "tipo sla",
      "description": ""
    },
    {
      "date": "14/12/2024",
      "hour": "23:55",
      "sender": "steh",
      "type": "text",
      "content": "n sei c eu tenho uma queda",
      "description": ""
    },
    {
      "date": "14/12/2024",
      "hour": "23:55",
      "sender": "steh",
      "type": "text",
      "content": "é um sentimento meio 😡😞🤮",
      "description": ""
    },
    {
      "date": "14/12/2024",
      "hour": "23:55",
      "sender": "steh",
      "type": "text",
      "content": "sabe",
      "description": ""
    },
    {
      "date": "14/12/2024",
      "hour": "23:56",
      "sender": "steh",
      "type": "text",
      "content": "mas n é como c c ele fosse pedir pra ficar cmg eu fosse aceitar",
      "description": ""
    },
    {
      "date": "15/12/2024",
      "hour": "00:00",
      "sender": "lav",
      "type": "text",
      "content": "PENSEI QUE ERA SEU NAMORADO GAY",
      "description": ""
    },
    {
      "date": "15/12/2024",
      "hour": "00:01",
      "sender": "lav",
      "type": "text",
      "content": "as vezes vc só não gosta muito dela",
      "description": ""
    },
    {
      "date": "15/12/2024",
      "hour": "00:02",
      "sender": "steh",
      "type": "text",
      "content": "afs",
      "description": ""
    },
    {
      "date": "15/12/2024",
      "hour": "00:02",
      "sender": "steh",
      "type": "text",
      "content": "não não",
      "description": ""
    },
    {
      "date": "15/12/2024",
      "hour": "00:02",
      "sender": "steh",
